{
  "object_type": "evidence_envelope",
  "envelope_kind": "protocol_neutral_evidence_projection",
  "contract_version": "0.1.0",
  "envelope_id": "envelope-0001",
  "created_at": "2026-08-05T12:15:00Z",
  "subject_ref": { "ref_type": "order", "id": "order-0001" },
  "projections": [
    {
      "protocol_family": "example-native-protocol",
      "protocol_version": "1.0",
      "native_object_type": "payment_requirements",
      "digest": {
        "algorithm": "sha-256",
        "encoding": "hex",
        "value": "a7a7a7a7a7a7a7a7a7a7a7a7a7a7a7a7a7a7a7a7a7a7a7a7a7a7a7a7a7a7a7a7"
      },
      "custody": { "disposition": "external_store", "location_hint": "evidence-store/native/0001" }
    },
    {
      "protocol_family": "example-native-protocol",
      "protocol_version": "1.0",
      "native_object_type": "settlement_response",
      "digest": {
        "algorithm": "sha-256",
        "encoding": "hex",
        "value": "b8b8b8b8b8b8b8b8b8b8b8b8b8b8b8b8b8b8b8b8b8b8b8b8b8b8b8b8b8b8b8b8"
      },
      "custody": { "disposition": "external_store", "location_hint": "evidence-store/native/0002" }
    }
  ],
  "referenced_objects": [
    { "ref_type": "payment_requirement", "id": "preq-0001" },
    { "ref_type": "settlement", "id": "settle-0001" }
  ],
  "observations": [
    { "check_id": "envelope.projection_digests_present", "path": "$.projections[0].digest", "state": "satisfied" },
    { "check_id": "envelope.projection_digests_present", "path": "$.projections[1].digest", "state": "satisfied" }
  ],
  "redactions": [
    { "redacted": true, "material_class": "bearer_token", "method": "omitted" }
  ]
}
